{
  "adjudicationDigest": "sha256:7ca2b873c0c84bc9422afbd6052ee549e084a07e035f50319b0a7f51bba9a414",
  "adjudicatorVersion": "s12.dense-hard.adjudicator.v2.1",
  "artifactVersion": "s12.dense-hard.evaluation-adjudication.v2.1",
  "auditExamples": {
    "dh2-001": {
      "deltas": {
        "hallucinatedFinalizedAssertions": -3,
        "semanticEditCount": -12,
        "typeCorrectionsExcluded": 6,
        "unsupportedFinalizedAssertions": -9
      },
      "legacyStrict": {
        "abstentionCorrect": true,
        "candidateAbstentionStatus": "none",
        "caseId": "dh2-001",
        "classification": "major",
        "difficultyTier": "dense-v2-baseline",
        "entity": {
          "candidate": 6,
          "dimensionDiffs": {
            "entity_extra": 0,
            "entity_label": 0,
            "entity_missing": 0,
            "entity_span": 0,
            "entity_type": 6
          },
          "f1": 0.0,
          "fn": 6,
          "fp": 6,
          "gold": 6,
          "precision": 0.0,
          "recall": 0.0,
          "tp": 0
        },
        "errorCodes": [
          "ENTITY_TYPE_MISMATCH",
          "RELATION_MISSING",
          "RELATION_EXTRA",
          "UNSUPPORTED_FINALIZED_ASSERTION",
          "HALLUCINATED_FINALIZED_ASSERTION"
        ],
        "expectedAbstentionMode": "none",
        "goldAbstentionRequired": false,
        "hallucinatedFinalizedAssertions": 3,
        "quarantineCorrect": 0,
        "quarantineIncorrect": 0,
        "quarantinePredicted": 0,
        "relation": {
          "candidate": 3,
          "dimensionDiffs": {
            "relation_endpoint": 0,
            "relation_evidence": 0,
            "relation_extra": 3,
            "relation_missing": 3,
            "relation_predicate": 0
          },
          "f1": 0.0,
          "fn": 3,
          "fp": 3,
          "gold": 3,
          "precision": 0.0,
          "recall": 0.0,
          "tp": 0
        },
        "scenarioId": "dh2-s-001",
        "semanticEditCount": 12,
        "slices": [
          "multi-hop",
          "multi-relation"
        ],
        "unsupportedFinalizedAssertions": 9
      },
      "protocolFair": {
        "abstentionCorrect": true,
        "candidateAbstentionStatus": "none",
        "caseId": "dh2-001",
        "classification": "minor",
        "difficultyTier": "dense-v2-baseline",
        "entity": {
          "candidate": 6,
          "f1": 1.0,
          "fn": 0,
          "fp": 0,
          "gold": 6,
          "precision": 1.0,
          "recall": 1.0,
          "tp": 6
        },
        "errorCodes": [
          "RELATION_EVIDENCE_MISMATCH"
        ],
        "expectedAbstentionMode": "none",
        "goldAbstentionRequired": false,
        "hallucinatedFinalizedAssertions": 0,
        "quarantineCorrect": 0,
        "quarantineIncorrect": 0,
        "quarantinePredicted": 0,
        "relation": {
          "candidate": 3,
          "f1": 1.0,
          "fn": 0,
          "fp": 0,
          "gold": 3,
          "precision": 1.0,
          "recall": 1.0,
          "tp": 3
        },
        "relationEndpointCorrections": 0,
        "scenarioId": "dh2-s-001",
        "semanticEditCount": 0,
        "slices": [
          "multi-hop",
          "multi-relation"
        ],
        "typeCorrections": 6,
        "typeDimension": "UNSCORABLE_PROTOCOL_AMBIGUITY",
        "unsupportedFinalizedAssertions": 0
      }
    },
    "dh2-002": {
      "deltas": {
        "hallucinatedFinalizedAssertions": -3,
        "semanticEditCount": -10,
        "typeCorrectionsExcluded": 4,
        "unsupportedFinalizedAssertions": -7
      },
      "legacyStrict": {
        "abstentionCorrect": true,
        "candidateAbstentionStatus": "none",
        "caseId": "dh2-002",
        "classification": "major",
        "difficultyTier": "dense-v2-baseline",
        "entity": {
          "candidate": 6,
          "dimensionDiffs": {
            "entity_extra": 0,
            "entity_label": 0,
            "entity_missing": 0,
            "entity_span": 0,
            "entity_type": 4
          },
          "f1": 0.3333333333333333,
          "fn": 4,
          "fp": 4,
          "gold": 6,
          "precision": 0.3333333333333333,
          "recall": 0.3333333333333333,
          "tp": 2
        },
        "errorCodes": [
          "ENTITY_TYPE_MISMATCH",
          "RELATION_MISSING",
          "RELATION_EXTRA",
          "UNSUPPORTED_FINALIZED_ASSERTION",
          "HALLUCINATED_FINALIZED_ASSERTION"
        ],
        "expectedAbstentionMode": "none",
        "goldAbstentionRequired": false,
        "hallucinatedFinalizedAssertions": 3,
        "quarantineCorrect": 0,
        "quarantineIncorrect": 0,
        "quarantinePredicted": 0,
        "relation": {
          "candidate": 3,
          "dimensionDiffs": {
            "relation_endpoint": 0,
            "relation_evidence": 0,
            "relation_extra": 3,
            "relation_missing": 3,
            "relation_predicate": 0
          },
          "f1": 0.0,
          "fn": 3,
          "fp": 3,
          "gold": 3,
          "precision": 0.0,
          "recall": 0.0,
          "tp": 0
        },
        "scenarioId": "dh2-s-002",
        "semanticEditCount": 10,
        "slices": [
          "multi-hop",
          "multi-relation"
        ],
        "unsupportedFinalizedAssertions": 7
      },
      "protocolFair": {
        "abstentionCorrect": true,
        "candidateAbstentionStatus": "none",
        "caseId": "dh2-002",
        "classification": "minor",
        "difficultyTier": "dense-v2-baseline",
        "entity": {
          "candidate": 6,
          "f1": 1.0,
          "fn": 0,
          "fp": 0,
          "gold": 6,
          "precision": 1.0,
          "recall": 1.0,
          "tp": 6
        },
        "errorCodes": [
          "RELATION_EVIDENCE_MISMATCH"
        ],
        "expectedAbstentionMode": "none",
        "goldAbstentionRequired": false,
        "hallucinatedFinalizedAssertions": 0,
        "quarantineCorrect": 0,
        "quarantineIncorrect": 0,
        "quarantinePredicted": 0,
        "relation": {
          "candidate": 3,
          "f1": 1.0,
          "fn": 0,
          "fp": 0,
          "gold": 3,
          "precision": 1.0,
          "recall": 1.0,
          "tp": 3
        },
        "relationEndpointCorrections": 0,
        "scenarioId": "dh2-s-002",
        "semanticEditCount": 0,
        "slices": [
          "multi-hop",
          "multi-relation"
        ],
        "typeCorrections": 4,
        "typeDimension": "UNSCORABLE_PROTOCOL_AMBIGUITY",
        "unsupportedFinalizedAssertions": 0
      }
    },
    "dh2-006": {
      "deltas": {
        "hallucinatedFinalizedAssertions": -3,
        "semanticEditCount": -9,
        "typeCorrectionsExcluded": 3,
        "unsupportedFinalizedAssertions": -6
      },
      "legacyStrict": {
        "abstentionCorrect": true,
        "candidateAbstentionStatus": "none",
        "caseId": "dh2-006",
        "classification": "major",
        "difficultyTier": "dense-v2-disambiguation",
        "entity": {
          "candidate": 6,
          "dimensionDiffs": {
            "entity_extra": 0,
            "entity_label": 0,
            "entity_missing": 0,
            "entity_span": 0,
            "entity_type": 3
          },
          "f1": 0.5,
          "fn": 3,
          "fp": 3,
          "gold": 6,
          "precision": 0.5,
          "recall": 0.5,
          "tp": 3
        },
        "errorCodes": [
          "ENTITY_TYPE_MISMATCH",
          "RELATION_MISSING",
          "RELATION_EXTRA",
          "UNSUPPORTED_FINALIZED_ASSERTION",
          "HALLUCINATED_FINALIZED_ASSERTION"
        ],
        "expectedAbstentionMode": "none",
        "goldAbstentionRequired": false,
        "hallucinatedFinalizedAssertions": 3,
        "quarantineCorrect": 0,
        "quarantineIncorrect": 0,
        "quarantinePredicted": 0,
        "relation": {
          "candidate": 3,
          "dimensionDiffs": {
            "relation_endpoint": 0,
            "relation_evidence": 0,
            "relation_extra": 3,
            "relation_missing": 3,
            "relation_predicate": 0
          },
          "f1": 0.0,
          "fn": 3,
          "fp": 3,
          "gold": 3,
          "precision": 0.0,
          "recall": 0.0,
          "tp": 0
        },
        "scenarioId": "dh2-s-006",
        "semanticEditCount": 9,
        "slices": [
          "repeated-labels",
          "different-occurrences",
          "multi-relation"
        ],
        "unsupportedFinalizedAssertions": 6
      },
      "protocolFair": {
        "abstentionCorrect": true,
        "candidateAbstentionStatus": "none",
        "caseId": "dh2-006",
        "classification": "minor",
        "difficultyTier": "dense-v2-disambiguation",
        "entity": {
          "candidate": 6,
          "f1": 1.0,
          "fn": 0,
          "fp": 0,
          "gold": 6,
          "precision": 1.0,
          "recall": 1.0,
          "tp": 6
        },
        "errorCodes": [
          "RELATION_EVIDENCE_MISMATCH"
        ],
        "expectedAbstentionMode": "none",
        "goldAbstentionRequired": false,
        "hallucinatedFinalizedAssertions": 0,
        "quarantineCorrect": 0,
        "quarantineIncorrect": 0,
        "quarantinePredicted": 0,
        "relation": {
          "candidate": 3,
          "f1": 1.0,
          "fn": 0,
          "fp": 0,
          "gold": 3,
          "precision": 1.0,
          "recall": 1.0,
          "tp": 3
        },
        "relationEndpointCorrections": 0,
        "scenarioId": "dh2-s-006",
        "semanticEditCount": 0,
        "slices": [
          "repeated-labels",
          "different-occurrences",
          "multi-relation"
        ],
        "typeCorrections": 3,
        "typeDimension": "UNSCORABLE_PROTOCOL_AMBIGUITY",
        "unsupportedFinalizedAssertions": 0
      }
    },
    "dh2-017": {
      "deltas": {